Subject,Number,Description
CLE,683,fourweek subinternship pediatrics provides supervised responsibility patient care general pediatric inpatient pediatric intensive care neonatal intensive care subintern gain awareness advanced knowledge skills values attitudes hospitalistsintensivists er physicians strive acquire maintain throughout professional lives professional completion core clerkships medicine curriculum
CLE,684,complete least subinternship rotation fourth year internal medicine subinternship work advanced clinical application medical knowledge gained core medicine clerkship professional medicine curriculum
CLE,685,provides indepth experience preparation knowledge procedures performed working patients require sedation anesthesia pain management various reasons anesthesia fellowships typically encompass experiences perioperativeperiprocedural locations experience thus aim provide exposure anesthesiologists typically work opportunity build trust providers four weeks possibly recommend future work field experience teach interact patients undergoing anesthesia allowing practice communicating treatment plans discussing concerns patients undergoing procedures additionally chance gain experience advanced skill sets work fields professional successful complete core clerkships medicine
CLE,686,illustrates advanced responsibilities activities expected demonstrate participate integral member neurology team advanced clinical rotation overall goal neurology subinternship give depth exposure neurology goal treating rotation like resident conduct depth eegs imaging interpretation differential diagnosis experience provide advanced clinical skills necessary future role resident exposed activities continue development according core entrustable professional activities epas entering residency related neurology professional medicine curriculum
CLE,687,overall goal obstetrics gynecology subinternship give indepth exposure obstetrics goal treating rotation resident carrying patients rotation give indepth exposure obstetrics gynecology goal performing acting interns increase ability assess patients develop differential diagnoses treatment options also increase exposure procedural cases experience provide advanced clinical skills necessary future role resident exposed activities continue development according core entrustable professional activities epas entering residency related obstetrics gynecology professional completion core medicine clerkships medicine curriculum
CLE,688,subinternship urology provides supervised responsibility patient care rotation provides opportunity function intern close oneonone attending supervision support staff interaction sub interns gain depth understanding principle urologic domains knowledge well working competence ambulatory evaluation surgical treatment urologic patient sub intern exposed disciplines urology limited open minimally invasive oncology traumareconstructive procedures voiding dysfunction infertility erectile dysfunction robotic minimally invasive procedures stones subinterns involved aspects urologic patient care initial presentation workup discharge planning followup sub intern participate operative cases direct supervision attending participation levels depending procedure patients clinical condition experience professional medicine curriculum medicine core clerkships urology elective surgery rotation urology elective
CLE,689,advanced clinical rotation final medical school aims provide advanced training knowledge skills attitudes foundational family medicine end subi ready assume role family medicine intern emphasis placed learners experience provision integrated accessible health care services clinicians accountable addressing large majority personal health care needs developing sustained partnership patients practicing context family community experiences multiple different subi obstetrical gynecologic procedures inpatient services minor procedures available skin biopsies cyst removals incision drainage joint injections implantable birth control insertion removal colposcopies outpatient care professional core clerkships medicine
CLE,690,encouraged participate research order enhance scientific reasoning fulfill colleges mission developing physician innovators allow engage broad spectrum research experiences work closely research mentor university urbanachampaign develop ideas generate list research outcomes professional medicine
CLE,692,provide clinicians chance meet nonclassroom environment discuss impact clinical practice examples domestic violence burnout cultural competence legal issues medicine readings websites videos prior session additionstudents write brief essays based experience clerkships electives session dinner approximately two professional curriculum md medicine
CLE,693,elective allow develop clinical skills gain clinical experience close supervision clinical modifying clinical elective better match interests customize clinical experience arranged individual member external collaborator subsequently assistant dean curriculum professional medicine
CLE,694,preparatory helps prepare graduating transition residency utilizes series interactive lectures handson workshops variety simulation methods skills training procedures clinical scenarios besides practice medicine caring patients also emphasis career planning life outside work professional completion medicine
CLE,695,medical act role subintern acting intern approximately part interdisciplinary inpatient team responsible patient panel commensurate subintern status follow throughout hospital stay subintern interview patients present rounds write admission psychiatry evaluations perform physicals appropriate write daily progress notes exposed discharge summary process addition subintern work consulting services provide handoffs collect collateral information coordinate aftercare participate full weekend call professional core clerkships medicine
CLE,696,subinternshipacting internship provides advanced medical handson experience consult liaison psychiatric setting learn conduct psychiatric evaluations provide treatment medically ill patients hospital setting gain proficiency ruling primary medical diagnoses managing comorbid medical conditions synthesizing knowledge skills acquired psychiatry clerkship professional successful completion core clerkships within medicine curriculum medicine
CLE,697,elective provides exposure challenges obesity overweight contributors poor health outcomes two weeks gain experience investigating better measures obesity strategies counter stigma mismanagement best practices intervention alternatives chronic weight management inequity care elective involves attendance outpatient clinic community events related obesity obesityrelated comorbidities professional successful completion family medicine clerkship medicine
CLE,702,introduced various anesthesia techniques management patients airway gain experience administration anesthetic drugs management critical life functions hemodynamics monitoring blood fluid therapy acute pain management postoperatively obstetrics pretest assess existing knowledge anesthesia clinical material help understand scope study rotation professional surgery clerkship md medicine curriculum
CLE,704,exposed private clinical practice general dermatology instructed diagnosis treatment emphasis placed care patient expected function member office team professional completion internal medicine clerkship md medicine
CLE,706,elective provide exposure specialty emergency medicine gain experience process assessing patient history taking physical exam diagnostics end elective able obtain complaint based history review system complete physical exam start formulate differential diagnosis based upon chief complaint stress placed development differential diagnosis experience learning appropriate laboratory radiographic testing well treatment options illnessesdisease commonly present emergency commonly get exposure patients chest pain abdominal pain neurological disorders undifferentiated malaise early pregnancy complaints sti sepsis trauma professional internal medicine surgery clerkship curriculum
CLE,707,participate ems ride alongs ems units eg ground transport air transport ems medical director dedicated physician response vehicle opportunity join fire simulations regional drills training tactical calls sporting events illini emergency medical services firsthand experience paramedics dispatchers teach critical patient management prehospital setting field dispatching center portion tailored interests ems event medicine mass gatherings medical simulation wilderness medicine professional completion core clerkships completion strongly encouraged medicine
CLE,713,healthcare providers able provide compassionate patientcentered care optimizes wellbeing alleviates suffering gain experiences caring patients advanced chronic progressive illness facing high symptom burden complex treatment decisions near end life gain experience subspecialty palliative care seeing patients inpatient consult services outpatient primary palliative care clinic embedded subspecialty clinics nursing home visits home visits participate interdisciplinary rounds work multidisciplinary team optimize patient care professional internal medicine clerkship curriculum
CLE,714,exposed outpatient management common cardiovascular disorders coronary artery disease valvular heart disease vascular disease heart failure atrial fibrillation well workup common referrals ambulatory setting chest pain shortness breath edema palpitations dizziness syncope abnormal ecg preoperative risk assessment also learn basic ecg interpretation opportunity observe stress testing nuclear imaging echocardiography goal develops history taking physical exam skills relates cardiovascular system integrating basic sciences medicine professional curriculum
CLE,715,goal elective expand knowledge understanding intensive care issues affecting hospitalized patients primarily focusing appropriate diagnostic therapeutic interventions provide opportunity assume primary role responsibility directing care patient team setting inherent experience opportunity indepth learning professionalism systemsbased practice elective encompass learning integrative skills procedures handle basic clinical scenarios codes partner attending develop diagnostic therapeutic plans patients engage formative experience designed prepare himher future care patients critical care professional internal medicine clerkship general surgery clerkship neurology clerkship medicine curriculum
CLE,716,goal elective serve internal medicine subspecialty hematology oncology outpatient setting exposed various hematological oncological conditions managed primarily outpatient exposure infusion center etc chemotherapy administered asked attend tumor board conferences whenever possible understand multidisciplinary management oncological problem also get inpatient experience introduced management oncological complications patients present hospital professional medicine curriculum
CLE,717,goal elective give exposure field infectious disease differential diagnosis treatment options management strategies able manage patients independently devise plans consults professional internal medicine core clerkship medicine
CLE,718,provide brief hiv epidemic cover modes transmission virus life cycle preventioneducation treatment strategies also discuss social history early epidemic within us global scale cover current continued social issues professional medicine internal medicine clerkship medicine
CLE,719,clinical elective designed expose broad range cardiovascular diseases inpatient setting limited acute coronary disease heart failures arrhythmias valvular disease also gain knowledge echocardiography ecg stress testing electrophysiology catheterization professional completion medicine internal medicine clerkship medicine
CLE,720,attend procedures perform consultations review cases attending gastroenterologists library learning assignments related patient cases presented office hospital active participant clinic seeing patients direct physician supervision professional successful completion internal medicine clerkship medicine curriculum
CLE,721,exposed outpatient management common cardiovascular disorders coronary artery disease hypertension valvular heart disease heart failure atrial fibrillation additionally workup common referrals ambulatory setting chest pain shortness breath edema palpitations coronary calcification syncope abnormal ecg preoperative risk assessment expected professional successful completion medicine curriculum
CLE,730,elective introduces medical diverse practice clinical genetics focus basic applied genetics genetic risk assessment genetic counseling relate prevention diagnosis treatment management disease serve basis healthcare professional holistically integrate geneticgenomics epigenetics scientific concepts personalized health care professional completion internal medicine clerkship pediatric clerkship family medicine clerkship medicine curriculum
CLE,731,elective embedded operational academic leaders throughout understand challenges presented leadership relationships knowledge work realworld challenge present idealike report build relationships help understand nature health systems leadership skills professional successful completion core clerkships medicine curriculum
CLE,732,designed provide different subspecialties neurosurgery forms basis strong foundation knowledge neurological diseases managed surgically nonsurgically immersed daytoday service functioning essentially supervised intern working closely cohesive group midlevel providers attendings inpatient outpatient operating room settings goal neurosurgery elective designed familiarize essential elements neurosurgical evaluation care able provide exceptional frontline management professional available honors grades md medicine curriculum
CLE,733,designed provide indepth experience different subspecialties neurosurgery builds foundation knowledge neurological diseases managed surgically nonsurgically immersed daytoday service functioning essentially supervised intern working closely cohesive group midlevel providers attendings inpatient outpatient operating room settings responsible composing oral presentation patient encountered elective research assignment assigned neurosurgery professional available honors grades neurosurgery md medicine curriculum
CLE,736,elective interested pursuing field obstetrics gynecology seek deeper knowledge responsibility field urogynecology provide complete experience clinical practice urogynecology surgery urodynamics clinical assessment pelvic floor disorders professional
CLE,737,elective interested field obstetrics gynecology medical surgical oncology experience seek deeper knowledge responsibility field gynecologic oncology rotation provide complete exposure clinical practice gynecologic oncology perform initial workup evaluation staging patients presenting malignancy working provider determine candidacy surgery assist surgical procedures also follow patients recovery surveillance professional successful completion medicine curriculum
CLE,738,rotation designed medical well versed obstetrics gynecology possibly interested pursuing residency obgyn activities revolve around workup infertile couple monitoring management treatment reproductive problems time spent office setting office ultrasounds consultations well management ovulation induction cycles monitoring ovarian hyperstimulation ivf observation ivf procedures assisting surgeries would expected additional time andrology ivf labs observing available professional successful completion clerkships medicine
CLE,739,rotation designed medical well versed obstetrics gynecology possibly interested pursuing residency obgyn activities revolve around work pregnancy pregnancyrelated complications time spent labor delivery antepartum outpatient maternal fetal medicine clinic outpatient midwifery clinic professional successful completion clerkships medicine curriculum
CLE,740,gain better understanding structure function human eye tools testing proper diagnosis treatments also learn various ocular diseases comanagement ocular systemic diseases understanding refer specialties professional repeat medicine
CLE,741,gives deep dive field ophthalmology deeper understanding structure function human eye common uncommon disease states instructed tools diagnosing common diseases diagnosis create propose treatment plan possible referrals preceptor professional family medicine surgery clerkships medicine
CLE,742,fourweek rotation consist familiarization general plastic reconstructive surgery emphasis depend upon current office surgical case load assist facets practice opportunity view wide range cosmetic plastic surgery clinical surgical experience provide solid foundation innovative ideas plastic reconstructive surgery professional surgery clerkship medicine curriculum
CLE,743,advanced clinical elective focusing management patients sustaining orthopedic injuries sequelae involved aspects continuum care initial emergency management nonoperative surgical treatment injuries inpatient care outpatient management patients sustaining fractures dislocations extremities pelvis work daily expected direct participation activities application basic science foundations anatomy cell biologysystems physiology fundamental biomechanical principles emphasized relate treatment fractures optimizing fracture healing director create proposed innovated solution orthopedic trauma situation professional surgery core clerkship medicine
CLE,744,provides exposure field oral maxillofacial surgery gain experience full scope surgical specialty traditional outpatient ambulatory surgery craniomaxillofacial trauma orthognathicreconstructive surgery cleft lip palate surgery maxillofacial oncology gain experience head neck surgical anatomy imaging principles management subspecialty additionally gain exposure application technology clinical problems role virtual surgical planning professional available honors surgery clerkship md medicine
CLE,745,provides exposure field oral maxillofacial surgery gain experience full scope surgical specialty traditional outpatient ambulatory surgery craniomaxillofacial trauma orthognathicreconstructive surgery cleft lip palate surgery maxillofacial oncology gain experience head neck surgical anatomy imaging principles management subspecialty advanced allow increased involvement day day management patients clinic emergency room inpatient setting operating room professional available honors surgery clerkship md medicine
CLE,746,elective designed seriously considering career otolaryngology seeking deeper knowledge emphasis diagnosis treatment common head neck disorders experience patients ambulatory surgery inpatient settings professional family med orientation md medicine curriculum
CLE,748,underlying modern diagnosis treatment complex surgical disease fascinating complex pathophysiology context current practitioner training become challenging address fundamental concepts detail sufficient initiate longterm interest scientific underpinnings surgical science rotation allows deep dive underlying physiology medical history modern diagnosis treatment meet surgical patients whose disease initiate investigations historical basic science underpinnings modern surgical care potential investigation classic medical physiology treatment hyperkalemia surgical patient particular attention associated cellular processes electrophysiology mechanisms noncytotoxic systemic cancer therapy immunotherapy gene protein directed therapy physiology systemic inflammatory response largely failed attempts intervene pathologic process cellular professional curriculum md medicine
CLE,750,clinical rotation designed provide comprehensive preview commonplace developmental behavioral problems experienced children community professional medicine curriculum medicine
CLE,751,elective exposed caring neonates neonatal intensive care unit nicu participate present daily rounds attend deliveries assist procedures learn basic principles neonatal care well diagnosis management common neonatal pathology professional medicine curriculum
CLE,752,goals pediatric pulmonology pediatric sleep medicine elective rotation delve common pediatric pulmonary sleep diagnoses asthma cystic fibrosis insomnia snoring become familiar less common conditions learn develop differential diagnosis generate plan care addition pharmacology physiology radiographic imaging pulmonary function testing polysomnography discussed relate various pulmonary sleep diagnoses professional curriculum
CLE,753,many important problems pediatric hematology encountered outpatient setting goals elective gain exposure diagnostic challenges evaluation anemia easy bruising bleeding abnormalities lymphadenopathy neutropenia thrombocytopenia autoimmune immunologic disorders additionally gain exposure patients sickle cell disease bleeding disorders clotting disorders finally management families facing challenges attention medical psychosocial factors provision care multidisciplinary team setting presented professional completion pediatrics clerkship medicine
CLE,764,provide inpatient physical medicine rehabilitation consult patients hospital possible admission admit patient perform history physical round daily attending physicians learn different types care provided physical medicine rehabilitation service rehabilitation electrodiagnosis general outpatient musculoskeletal rehabilitation nonhealing wound care rehab opportunity work physician determine goals objectives patient rehabilitation opportunity observe interact rehabilitation team members physical occupational therapists speechlanguage pathologists rehabilitation social work case management nutrition psychology outpatients seen musculoskeletal problems professional family medicine md medicine
CLE,765,participating elective gain initial exposure orthopedic sports medicine clinic setting operating room work oneonone operating room clinic care orthopedic sports medicine patients elective tailored individual needs interest educational professional
CLE,771,unique elective offers direct access rapidly developing field addiction medicine take part direct patient care outpatient addiction specialty clinic multidisciplinary team providers also opportunity attend drug court champaign county participate needle exchange champaign county public health satisfactory completion gained better understanding evidencebased treatment options individuals living substance disorders also firsthand experience combating greatest challenges facing modern medicine opioid epidemic professional md medicine
CLE,772,interested pursuing psychiatry residency manage adult outpatient psychiatric care childadolescent outpatient psychiatric care elective learn indepth evaluation diagnosis safe management psychiatric patients ambulatory setting work oneonone attending psychiatrist supervisor achieve goals addition attend relevant meetings professional development sessions didactics also participate care coordination meetings professional successful completion medicine psychiatry clerkship medicine curriculum
CLE,773,radiotherapy integral part modern multidisciplinary cancer care clinical elective designed introduce field radiation oncology radiotherapy provide direct experience evaluation management patients malignant disease well occasional benign conditions regarding radiotherapy learn epidemiology pathophysiology staging cancer patients utilize evidencebased approaches treatment opportunities learn basic information radiobiology physics inform understanding radiotherapy planning treatment delivery augment direct patient care interactions attendance multidisciplinary tumor conferences oncologic specialties well quality assurance rounds professional medicine core clerkship medicine
CLE,774,simulated ultrasound elective enables develop skills related clinical ultrasound utilizing sonosim associated online modules opportunity enhance understanding imaging tool prepare clinical environments could benefit pointofcare ultrasound learn ultrasound principles acquisition skills online selfpaced module professional medicine
CLE,775,clinical ultrasound elective enables explore specialties pointofcare ultrasound utilized learn ultrasound principles acquisition skills online selfpaced module learn observing sonographers providing opportunity refine skills observation questions work attending providers four different inpatient specialties assess care patients identifying cases ultrasound imaging useful professional curriculum
CLE,776,observe acquisition interpretation diagnostic examsthese limited plain film fluoroscopy computerized axial tomography magnetic resonance imaging addition observe ultrasonography nuclear medicine procedures ultrasound thyroid abdominal structures nuclear medicine interpretations bone scans thyroid scans petct review films correlated clinical experiences future residency plans read assigned material dealing basic diagnostic fundamental radiology attend conferences related imaging service observe invasive diagnostic procedures occurring imaging professional curriculum md medicine
CLE,777,observe work vascular interventional radiology team foundation hospital observe participate clinical management patient disease pathophysiology involving entire human body organ systems learn basic imaging principles applied management treatment disease special attention minimally invasive imaging guided techniques professional curriculum md medicine
