Subject,Number,Description
GEOL,118,introduces nature causes risks effects prediction natural disasters earthquakes volcanoes landslides subsidence global climate change severe weather coastal erosion floods mass extinctions meteorite impacts covers scientific principles case histories natural disasters well human responses societal impact mitigation strategies public policy
GEOL,208,presents systematic analysis formation evolution earth dynamic systems lithosphere hydrosphere atmosphere biosphere also introduces methods reconstructing earths history geochronology paleontology stratigraphic records introduces geological history life evolution mountain belts continents geochemical systems climate sea earths interior field trip additional
GEOL,333,studies origin identification environmental significance earth materials minerals rocks soil environmental mineral resources acid mine drainage volcanic hazards swelling soils engineering strength porositypermeability architectural uses earth materials asbestos day field trip additional
GEOL,390,research individual study geology plus counted toward graduation supervising member advance geology
GEOL,391,research individual study geology honors plus counted toward graduation supervising member honors advisor advance geology
GEOL,415,group field study prominent geologic locality inclass meetings studentled presentation field trip trips run spring break winter break midend intercession dates depend location additional
GEOL,432,crystallography crystal optics structure composition properties stability geological occurrences minerals mineral identification additional
GEOL,440,introduces dynamics sedimentation geology sedimentary basins distribution geologic processes time definition correlation stratigraphic units principles paleogeography stratigraphy tectonics additional
GEOL,450,overview seismology magnetics gravity geodesy surface geology help us understand earth surface core well temporal evolution internal composition dynamics earth generation earths gravitational geomagnetic fields driving mechanisms tectonic plate motion continental deformation surface topography wanting quantitative treatment geophysics enroll
GEOL,460,fundamental chemical physical concepts applied geological processes origin distribution geochemical behavior elements chemical evolution earth geochemistry natural waters sedimentary rocks isotope geochemistry crystal chemistry trace element geochemistry organic geochemistry
GEOL,490,conduct research direct supervision geology member research either summary paper poster presentation regional national science conference six counted toward graduation supervising member advance geology primarily sophomores juniors available
GEOL,491,conduct research honors direct supervision geology member research either summary paper poster presentation regional national science conference counted toward graduation supervising member honors advisor advance dept geology primarily sophomores juniors james scholars chancellors scholars available
GEOL,492,research geology thesis thesis submitted received plus counted toward graduation supervising member
GEOL,493,research geology honors thesis thesis submitted received plus counted toward graduation supervising member honors advisor
GEOL,497,seminar lectures subjects covered regular advanced undergraduates additional
GEOL,515,group field study prominent geologic locality inclass meetings studentled presentation field trip trips run spring break winter break midend intercession dates depend location additional
GEOL,561,covers geomicrobiology relates geochemistry primary focus groundwater environments energetics microbial metabolism influence microorganisms geochemistry geochemical influences microbial ecology biogeochemical cycles molecular biology tools groundwater year collegelevel chemistry biology recommended
GEOL,572,hydrogeologic concepts realworld datasets explored coding language python associated packages scipy numpy pandas matplotlib flopy data imported variety sources analyzed develop scientific models finally visualized handson experience evaluating well tests determine aquifer properties developing geologic potentiometric surfaces observed data understanding implications boundary conditions surface waters faults regional groundwater flow professional
GEOL,579,application isotope measurements hydrogeology groundwater age dating stable isotope ratios anthropogenic radionuclides considered context studying broad range hydrologic problems siting nuclear waste disposal understanding migration groundwater sedimentary basins
GEOL,591,brings uptodate current research broad spectrum geoscience improves oral presentation skills practice example geology geology
GEOL,593,work following fields general geology field trip fee b engineering geology c geomorphology glacial geology clay mineralogy e groundwater geology f geomicrobiology g geological fluid dynamics h mineralogy crystallography paleontology j geochemistry k geophysics l petrography petrology sedimentology n stratigraphy oceanography p submarine geology q structural geology geotectonics r mathematical geology sedimentary petrography petroleum geology u coal geology v isotope geology geochronology w electron beam analysis x vulcanology environmental geology z planetology additional
GEOL,599,individual research supervision members respective fields
GER,101,introductory focusing listening comprehension oral skills reading writing culture
GER,102,continuation continued focus listening comprehension oral skills reading writing culture introductory german
GER,103,continuation intermediate focusing listening comprehension oral skills reading writing culture two german
GER,104,continuation continued focus listening comprehension oral skills reading writing culture intermediate three german
GER,191,study selected individually arranged basis open honors cohn scholars associates honors advisor
GER,212,continuation
GER,251,special attention paid grimms tales traditional narrative genres elements life early modern europe versions italy france well germany conducted english
GER,261,cultural representations holocaust literature film critical essays
GER,299,lectures seminars practical work german language literature civilization academic appropriate study overall average average german
GER,321,german language used professional contexts involving economic matters texts documents relating forms enterprises financing macroeconomic structures domestic foreign trade reports economies germanspeaking countries
GER,420,general german culture prechristian period twentyfirst century focusing tension forces history modernization german culture materials literary philosophical texts film painting music particular attention paid role society german
GER,465,linguistic analysis germanic languages historical geographic social context taught german english depending topic taught english taught german recommendation
GER,491,primarily candidates honors german open seniors
GER,496,intensive study german language literature culture three german
GER,573,seminar selected genres themes authors eighteenth century professional
GGIS,101,introduces geographical perspectives environment development studies case studies drawn africa asia latin america investigates origins global south relation global north especially historical contemporary processes driving environmental economic cultural change
GGIS,204,indepth exploration global urbanization comparative regional approach discuss recent history global urbanization dissect problems offer possible solutions approximately ten regions world examined exploring significant urban patterns processes built natural environments social economic cultural landscapes
GGIS,210,complex relationship people natural environment social science perspective explores different approaches environmental issues role population change political economy technologies environmental policymaking social institutions causing resolving contemporary social environmental global issues
GGIS,222,interdisciplinary approach study big rivers encompassing geomorphology engineering ecology risk assessment planning commencing assessment nature big rivers hydrology geomorphic setting hazards associated large rivers issues river impoundment management proceed geography geomorphology ecology management range worlds greatest rivers focusing geomorphological understanding large rivers aid study riverine ecohabitats inform decisions regarding water usage engineering management weather permits day fieldtrip organized second half view aspects local river illinoisindiana
GGIS,223,role engineers technology geopolitics midnineteenth century present colonialism world wars cold war war terror historical contexts covered presentday politics grounded longer histories illustrate engineering technology continue transform geopolitical relations
GGIS,224,systematic analysis environmental human processes shaping rural urban data science lens
GGIS,254,broaden understanding united states physical human geography interact produce unique cultural landscapes covers multiple regions us exploring significant spatial patterns processes built natural environments social economic cultural landscapes focuses experiences minority cultures us specific themes environmental justice memory memorials music food
GGIS,379,investigates fundamentals geographic information science well basic skills execution theoretical knowledge industry standard software packages learn basics projections coordinate systems geographic information stored manipulated theory practice behind production thematic maps lecture handson laboratory components
GGIS,380,study analytical capabilities geographic information systems emphasis learning solve spatial problems vector raster data formats develop skills necessary answer questions solve problems interest particular emphasis problems questions require multiple steps resolve learn fundamental theory behind spatial problem solving also learn execute procedures industrystandard software packages thus contains lecturediscussion elements handson laboratory work
GGIS,390,supervised independent study special regions least formal topic region interest
GGIS,391,independent study research projects working toward distinction geography honors adviser
GGIS,392,supervised offcampus experience field directly pertaining geography gis written report end internship relating work accomplishments study sponsor director studies least two within geography gis
GGIS,407,introduce cybergis geospatial information science systems gis based advanced cyberinfrastructure well state highperformance computing big data cloud computing context geospatial data science cybergisx innovative cybergis framework conducting dataintensive reproducible scalable geospatial analytics jupyter notebook primary user environment expected learn develop jupyter notebooks analyze visualize geospatial data leadingedge cybergis software python libraries emphasis placed learning cuttingedge advances cybergis underlying geospatial data science principles
GGIS,439,spatial technologies data address issues health disease outbreak surveillance response environmental factors climate socioeconomic context medical data needed spatial analysis health information applicationbased learning lectures complemented readings guest lectures discussions geographic information system global positioning system covered examples drawn public veterinary health introductory statistics geog
GGIS,460,review methods extracting quantitative qualitative information aerial photographs computerbased techniques visual interpretation first part cover basic photogrammetry mapping second part focus interpretation physical biological cultural features knowledge trigonometry basic physical geography
GGIS,465,descriptors transportation systems transportation industrial activity public good transportation spatial development role transportation urban regional development emphasis economic environmental social aspects sustainability transportation systems activities enable local regional national global levels field trip additional
GGIS,466,examination geographical political aspects humanenvironmental relations focusing environmental problems defined negotiated addressed policy formulation specific approaches environmental policy considered different geographical scales geography political science
GGIS,476,application remote sensing geographic information system gis technologies solving geospatial environmental problems
GGIS,477,fundamentals energymatter interaction mechanisms manifestation reflected emitted radiation photographs images introduces characteristics aerial films filters electrooptical scanners digital processing emphasizes applications environmental problems
GGIS,478,introduce remote sensing techniques identify features phenomena surface earth aircraft satellite platforms covered remotely sensed data sensor systems optical thermal lidar hyperspectral remote sensing techniques image enhancement image classification applications remote sensing various domain fields
GGIS,480,focuses geographic information science giscience principles underlie development geographic information systems gis software intelligent helps adapt rapidly changing geospatial technologies knowledge gained general thus limited specific software product revised future
GGIS,489,programming customize extend capabilities geographic information systems principles programming advanced function tools coding visualization fundamental spatial data structures spatial algorithms ggisese
GGIS,491,detailed examination discussion methods initiating executing research projects human physical geography taught sections requires write research proposal quality suitable thesis either geography geography
GGIS,495,explores special covered regularly scheduled geography
GGIS,507,introduce highperformance geospatial computing python resolve computational bottlenecks produce faster scalable solutions learn python highperformance parallel computing architecture specifically numpy scipy numba cython covered optimize speed geospatial computation cybergisx primary learning environment expected learn develop notebooks address computational challenges solving geospatial problems end gained solid knowledge common python tools developing highperformance geospatial computing solutions applied many applications professional
GGIS,517,introduce geospatial visualization visual analytics well stateoftheart cartographic mapping visualization technologies context cybergis cyber geospatial information science systems geospatial data science learn open source mapping visualization libraries leaflet plotly mash libraries create interactive dynamic visualization tools gis applications expected learn visualize geospatial data also results spatial analysis emphasis placed learning cuttingedge advances geospatial visualization visual analytics practical skills create geospatial applications based advances professional
GGIS,570,advanced techniques spatial analysis spatial autocorrelation trend surface analysis grouping regionalization procedures point pattern analysis professional
GGIS,590,independent research project thesis topic development supervised geography gis advisor professional passing preliminary exam phd candidates thesis research instead
GGIS,593,weekly research presentations invited speakers geography gis phd wide range excluding professional
GGIS,594,advanced study current research social geography topic prepares thesis dissertation research study relevant literature completion research paper professional
GGIS,595,graduatelevel exploration topic geography gis covered existing instructors professional
GGIS,598,individual project demonstrates ability solve advanced geospatial problem develop gisbased application work closely capstone advisor determine project focus expected outcomes professional
GGIS,599,individual research supervision members respective fields professional
GLBL,100,foundation understanding range contemporary issues learning analyze multiple disciplinary perspectives consider globalizing trends within themes wealth poverty population cultures human rights environment sustainability governance conflict cooperation objectives enhance knowledge human cultures interactions impacts world develop skills successfully negotiating realities contemporary societies promote values global learning diversity sustainable futures
GLBL,200,foundations interdisciplinary social science research topic understanding purpose research identifying researchable issues finding evaluating sources effectively recognizing methods associated different types data disciplines writing literature review prepares coursebased research papers advanced research methods guest present global studiesrelevant research blog research interests
GLBL,225,teaches global studies academic interests identify internships servicelearning learning opportunities relevant prepare application materials conduct informational interviews participate mock job interviews explore networking strategies create career narrative represents academic interests skills prepares expect internships develop leadership skills
GLBL,250,interdisciplinary theory practice international development defining development ideas changed time interventions used development work impacts
GLBL,260,ideas human rights defined differentially deployed looks human rights claims crises governmental nongovernmental individuals organizations sought deal human rights violations order address problems justice retribution reconciliation personal national international levels
GLBL,270,global markets economic systems evolving relationship societies global north south presents interdisciplinary perspectives business structures conduct emphasis philosophical foundations economic systems international business networks technological innovation business environments nonwestern settings global workforce composition divisions labor relationships business development environment international organizations support spread global business
GLBL,296,examination current controversies larger ethical issues todays global society could immigration global environmental debates population issues
GLBL,298,seminars introduce aspects globalization case study particular location abroad campus explore historical contemporary aspects location abroad prepare field visit abroad engage local resources people better understand local site contributes impacted relevant global processes focus activities field site visit abroad discussions lectures short essays presentation final projects according site location expertise
GLBL,340,identifies central emerging global health issues analyzes lenses governance policy gender focuses structural policy institutional perspectives global health emphasis decisions influenced made
GLBL,392,complexities international diplomacy negotiations among states actors focuses three main subject negotiation analysis applied negotiation interaction practical considerations affect negotiations utilizes theoretical casebased activelearning approaches explored detail issues security public health economic development human rights environment
GLBL,440,focuses process crafting solution evaluation plan related specific global health problem identified requires work teams integrate content learning global health applied project design skills developed higher
GLBL,450,decades wide range strategies initiatives applied alleviate poverty developing countries record initiatives mixed millions people moved poverty billion remain persistently impoverished range antipoverty approaches implemented evaluates effectiveness gain familiarity interventions understanding techniques used evaluate
GLBL,495,second optional capstone experience internationalglobal studies designed guide interpretation data development conclusions implications addition final project learn write paper abstract conference proposal well acquire presentation skills
GLBL,499,selected reading research global studies current six global studies anthropology social geography political science sociology economics
GLBL,501,provides variety fields understanding key global concepts methods introduces different perspectives globalization transnational social relations professional
GRK,102,continuation grammar reading classical koine greek
GRK,202,continuation readings classical greek prose narrative epistolary testament texts
GRK,401,advanced readings ancient greek literature
GRK,492,thesis honors open candidates distinction greek classics honors
GRK,520,alternating poetry prose concentrates author following epic history lyric poetry oratory drama philosophy normally follow sequence successive
GRK,599,guidance writing theses advanced degrees
GRKM,202,develops elementary proficiency spoken written modern greek familiarity elements cultural knowledge modern greek morphology syntax emphasizes listening comprehension reading skills writing conversational abilities online language laboratory internet assignments
GRKM,404,consolidates knowledge modern greek grammar vocabulary enables converse modern greek exposing different uses modern greek daytoday communication also offers aspects modern greek literature addition listening comprehension reading skills emphasizes writing conversational abilities online language laboratory internet assignments
GRKM,454,continued practice enable improve fluency modern greek effectively variety contexts spring
GS,101,opportunities resources available undeclared division general studies introduces breadth diverse fields study available prepares dgs myriad potential careers helps foster sense collaboration engagement campus orientation study projectbased assignments
GS,102,seminar firstyear dgs enrichment experience learn develop strengths interests transferable skills investigating current evolving societal challenges discussion readings semesterlong project explore variety leadership creativity research service also learn craft experience understanding many opportunities available firstyear dgs enrichment experience dee attribute
GS,299,provides toward study accredited foreign institutions overseas programs final determination made upon completion work session earned within calendar year year residence uiuc good academic prior division general studies
GSD,101,broad survey provide across campus interdisciplinary game studies covering historicalsocial perspectives game design explore humanities social science understandings play social contexts games gaming practices arise well development consequences gaming cultures serve broad issues covered greater depth upperlevel available pursuing minor game studies design
GSD,103,introduce tools principles game design well history game studies maker movement learn introductory tools techniques rapid prototyping along exploring games history impacts design
GSD,199,individual study subject related game studies design covered normal freshmen sophomores
GSD,202,explores ways play integrated sociocultural fabric develop broad understanding play different contexts history play nature play human development learning play spaces games futurist thinking chief among goals emphasis play fundamental enriching force people ages something cultivate life
GSD,390,advanced study skillsbased instruction emerging special topic related game studies design covered normal specified topic offering
GSD,399,advanced individual study subject related game studies design covered normal juniors seniors
GSD,405,emphasis understanding video game development process seen current game studios focus key elements process development timeline scheduling prototyping iteration qa game builds player research goal take design document catalog designs already created implement game development process dc video game dev process sections
GSD,411,studio explores intersection interactivity written wordencompassing fiction nonfiction poetry although many works examined contain gameplay mechanics focus expressive possibilities interactive storytelling create hypertext narratives twine software prior programming experience assumed
GSD,490,current interest advanced study emerging special topic related game studies design covered normal specified topic offering
GSD,504,teamtaught seminar provides indepth exploration significant social psychological historical critical game studies focusing theoretical approaches methodological issues aspects contemporary game studies research create intellectual community game studies minors whose main interest research games rather design development games guest speakers participating academic units help moderate interdisciplinary series discussions range theoretical methodological issues pertinent contemporary academic game studies research take part minor expected return seminar guest speaker near end share research professional
GSD,597,advanced individual study subject related game studies design covered normal project examples comprehensive literature reviews topic special emerging interest small research projects eg surveys playtesting experiments development projects eg building game based design developed part another study preapproval advisor commit supervise independent study professional total
GWS,100,interdisciplinary study gender women sexuality addresses issues social experience representation popular culture femininities masculinities family structure education employment economics literature religion history technology explores interrelationships race ethnicity sexuality gender ability age transnational perspective
